{
  "_type": "https://in-toto.io/Statement/v1",
  "subject": [
    {"name": "Customer", "digest": {"sha256": "ca978112ca1bbdcafac231b39a23dc4da786eff8147c4e72b9807785afee48bb"}},
    {"name": "Invoice", "digest": {"sha256": "3e23e8160039594a33894f6564e1b1348bbd7a0088d42c4acb73eeaed59c009d"}},
    {"name": "InvoiceLine", "digest": {"sha256": "2e7d2c03a9507ae265ecf5b5356885a53393a2029d241394997265a1a25aefc6"}}
  ],
  "predicateType": "https://github.com/nick-developer/relsynth/run-manifest/1",
  "predicate": {
    "run": {
      "id": "01JBX7Q3V8M4Z2N6K9T5R1W0YH",
      "started": "2026-11-03T09:12:44Z",
      "finished": "2026-11-03T09:31:02Z",
      "operator": {"name": "A. Analyst", "key": "ed25519:SHA256:3q2+7w8kQ0d1r9v5n6m4b2x1c0z9l8k7j6h5g4f3d2s="},
      "command": "relsynth run spec.yaml --dp --context partner --target partner-sftp"
    },
    "source": {
      "id": "dwh-prod",
      "domain": "customers",
      "fingerprint": {
        "locator_hmac": "18ac3e7343f016890c510e93f935261169d9e3f565436429830faf0934f4f8e4",
        "schema_sha256": "3f79bb7b435b05321651daefd374cdc681dc06faa65e374e38337b88ca046dea",
        "snapshot": "pg_xact:88213077"
      }
    },
    "spec": {
      "digest": {"sha256": "252f10c83610ebca1a059c0bae8255eba2f95be4d1d7bcfa89d7248a82d9f111"},
      "ir_digest": {"sha256": "cd0aa9856147b6c5b4ff2b7dfee5da20aa38253099ef1b4a64aced233c9afe29"},
      "ir_version": "2.0",
      "public_facts_only": true
    },
    "software": {"relsynth": "2.5.0", "accountant": "opendp 0.12.1", "python": "3.12.7", "platform": "linux-x86_64"},
    "seeds": {"generator": 20261103, "assessment_split": 7},
    "privacy": {
      "mode": "dp",
      "unit": "Customer",
      "adjacency": "add_remove",
      "charges": [
        {"stage": "fit", "mechanism": "gaussian: GROUP BY counts per segment", "kind": "zcdp", "rho": "0.010"},
        {"stage": "fit", "mechanism": "gaussian: binned marginals", "kind": "zcdp", "rho": "0.025"},
        {"stage": "fit", "mechanism": "gaussian: rank correlations", "kind": "zcdp", "rho": "0.015"}
      ],
      "run_total": {"rho": "0.050", "delta": "0"},
      "stated": {"epsilon": "1.882", "delta": "1e-9"},
      "ledger": {"seq": 412, "domain_rho": "0.080", "domain_delta": "0", "domain_epsilon": "2.413"}
    },
    "reports": [
      {"kind": "dp_statement", "schema": "relsynth.dp-statement/1", "digest": {"sha256": "aaa9402664f1a41f40ebbc52c9993eb66aeb366602958fdfaa283b71e64db123"}, "external_safe": true},
      {"kind": "privacy", "schema": "relsynth.privacy-report/1", "digest": {"sha256": "de7d1b721a1e0632b7cf04edf5032c8ecffa9f9a08492152b926f1a5a7e765d7"}, "external_safe": false},
      {"kind": "quality", "schema": "quality-report-2.0", "digest": {"sha256": "189f40034be7a199f1fa9891668ee3ab6049f82d38c68be70f596eab2e1857b7"}, "external_safe": false}
    ],
    "verdicts": {"internal": "pass", "partner": "pass", "public": "review"},
    "policy": {
      "digest": {"sha256": "ca978112ca1bbdcafac231b39a23dc4da786eff8147c4e72b9807785afee48bb"},
      "version": "2026-11-01.1",
      "engine": "opa 1.4.2",
      "decisions": {
        "partner": {"allow": true, "approval_required": true, "reasons": []}
      }
    },
    "release": {"context": "partner", "target": "partner-sftp"},
    "chain": {"prev": "3e23e8160039594a33894f6564e1b1348bbd7a0088d42c4acb73eeaed59c009d"}
  }
}
